Enter password: *****
Welcome to the MySQL monitor.  Commands end with ; or \g.
Your MySQL connection id is 9
Server version: 8.0.21 MySQL Community Server - GPL

Copyright (c) 2000, 2020, Oracle and/or its affiliates. All rights reserved.

Oracle is a registered trademark of Oracle Corporation and/or its
affiliates. Other names may be trademarks of their respective
owners.

Type 'help;' or '\h' for help. Type '\c' to clear the current input statement.

mysql> use stud;
Database changed


mysql> create table stud_info(Rollno int primary key,name varchar(20),phy_mark varchar(20),chem_mark varchar(20),math_mark varchar(20));
Query OK, 0 rows affected (2.01 sec)

mysql> create table student_info(Rollno int primary key,name varchar(20),phy_mark int,chem_mark int,math_mark int);
Query OK, 0 rows affected (0.88 sec)

mysql> insert into student_info values(1,'ABC',67,56,66);
Query OK, 1 row affected (0.13 sec)

mysql> insert into student_info values(2,'PQR',77,78,55);
Query OK, 1 row affected (0.08 sec)

mysql> insert into student_info values(3,'LMN',67,68,65);
Query OK, 1 row affected (0.07 sec)

mysql> insert into student_info values(4,'MNO',57,78,75);
Query OK, 1 row affected (0.18 sec)

mysql> insert into student_info values(5,'XYZ',47,68,57);
Query OK, 1 row affected (0.09 sec)

mysql> insert into student_info values(6,'WXYZ',57,76,98);
Query OK, 1 row affected (0.13 sec)

mysql> select * from student_info;
+--------+------+----------+-----------+-----------+
| Rollno | name | phy_mark | chem_mark | math_mark |
+--------+------+----------+-----------+-----------+
|      1 | ABC  |       67 |        56 |        66 |
|      2 | PQR  |       77 |        78 |        55 |
|      3 | LMN  |       67 |        68 |        65 |
|      4 | MNO  |       57 |        78 |        75 |
|      5 | XYZ  |       47 |        68 |        57 |
|      6 | WXYZ |       57 |        76 |        98 |
+--------+------+----------+-----------+-----------+
6 rows in set (0.04 sec)
 
mysql> create table teacher_info(t_name varchar(20) primary key,sub varchar(20));
Query OK, 0 rows affected (1.60 sec)

mysql> insert into teacher_info values('Anu','english');
Query OK, 1 row affected (0.16 sec)

mysql> insert into teacher_info values('manu','maths');
Query OK, 1 row affected (0.14 sec)

mysql> insert into teacher_info values('pranita','physics');
Query OK, 1 row affected (0.07 sec)

mysql> insert into teacher_info values('vaishali','chemestry');
Query OK, 1 row affected (0.08 sec)

mysql> insert into teacher_info values('praju','science');
Query OK, 1 row affected (0.13 sec)

mysql> create table students(Rollno int primary key,name varchar(20),class varchar(20),t_name varchar(20) references teacher_info);
Query OK, 0 rows affected (1.36 sec)

mysql> insert into students values('1','mona','fy','vaishali');
Query OK, 1 row affected (0.08 sec)

mysql> insert into students values('2','sona','sy','anu');
Query OK, 1 row affected (0.14 sec)

mysql> insert into students values('3','renu','ty','manu');
Query OK, 1 row affected (0.07 sec)

mysql> insert into students values('4','anushka','fy','pranita');
Query OK, 1 row affected (0.10 sec)

mysql> insert into students values(5,'swaraj','fybsc','praju');
Query OK, 1 row affected (0.08 sec)

mysql> insert into students values(6,'raju','bsc','Anu');
Query OK, 1 row affected (0.15 sec)

mysql> select * from students;
+--------+---------+-------+----------+
| Rollno | name    | class | t_name   |
+--------+---------+-------+----------+
|      1 | mona    | fy    | vaishali |
|      2 | sona    | sy    | anu      |
|      3 | renu    | ty    | manu     |
|      4 | anushka | fy    | pranita  |
|      5 | swaraj  | fybsc | praju    |
|      6 | raju    | bsc   | Anu      |
+--------+---------+-------+----------+
6 rows in set (0.00 sec)

mysql> select * from teacher_info;
+----------+-----------+
| t_name   | sub       |
+----------+-----------+
| Anu      | english   |
| manu     | maths     |
| praju    | science   |
| pranita  | physics   |
| vaishali | chemestry |
+----------+-----------+
5 rows in set (0.06 sec)


mysql> delete  from students where rollno='2';
Query OK, 1 row affected (0.08 sec)

mysql> select * from students;
+--------+---------+-------+----------+
| Rollno | name    | class | t_name   |
+--------+---------+-------+----------+
|      1 | mona    | fy    | vaishali |
|      3 | renu    | ty    | manu     |
|      4 | anushka | fy    | pranita  |
|      5 | swaraj  | fybsc | praju    |
|      6 | raju    | bsc   | Anu      |
+--------+---------+-------+----------+
5 rows in set (0.04 sec)

mysql> select * from students where rollno=1 AND name='mona';
+--------+------+-------+----------+
| Rollno | name | class | t_name   |
+--------+------+-------+----------+
|      1 | mona | fy    | vaishali |
+--------+------+-------+----------+
1 row in set (0.00 sec)

mysql> select * from students where name like 'r%';
+--------+------+-------+--------+
| Rollno | name | class | t_name |
+--------+------+-------+--------+
|      3 | renu | ty    | manu   |
|      6 | raju | bsc   | Anu    |
+--------+------+-------+--------+
2 rows in set (0.00 sec)

mysql> select * from student_info;
+--------+------+----------+-----------+-----------+
| Rollno | name | phy_mark | chem_mark | math_mark |
+--------+------+----------+-----------+-----------+
|      1 | ABC  |       67 |        56 |        66 |
|      2 | PQR  |       77 |        78 |        55 |
|      3 | LMN  |       67 |        68 |        65 |
|      4 | MNO  |       57 |        78 |        75 |
|      5 | XYZ  |       47 |        68 |        57 |
|      6 | WXYZ |       57 |        76 |        98 |
+--------+------+----------+-----------+-----------+
6 rows in set (0.05 sec)


mysql> select * from student_info where phy_mark>=60 order by name ASC;
+--------+------+----------+-----------+-----------+
| Rollno | name | phy_mark | chem_mark | math_mark |
+--------+------+----------+-----------+-----------+
|      1 | ABC  |       67 |        56 |        66 |
|      3 | LMN  |       67 |        68 |        65 |
|      2 | PQR  |       77 |        78 |        55 |
+--------+------+----------+-----------+-----------+
3 rows in set (0.03 sec)

mysql> select * from student_info where phy_mark>=60 order by name desc;
+--------+------+----------+-----------+-----------+
| Rollno | name | phy_mark | chem_mark | math_mark |
+--------+------+----------+-----------+-----------+
|      2 | PQR  |       77 |        78 |        55 |
|      3 | LMN  |       67 |        68 |        65 |
|      1 | ABC  |       67 |        56 |        66 |
+--------+------+----------+-----------+-----------+
3 rows in set (0.00 sec)

mysql> select * from student_info where chem_mark>=60 order by name desc;
+--------+------+----------+-----------+-----------+
| Rollno | name | phy_mark | chem_mark | math_mark |
+--------+------+----------+-----------+-----------+
|      5 | XYZ  |       47 |        68 |        57 |
|      6 | WXYZ |       57 |        76 |        98 |
|      2 | PQR  |       77 |        78 |        55 |
|      4 | MNO  |       57 |        78 |        75 |
|      3 | LMN  |       67 |        68 |        65 |
+--------+------+----------+-----------+-----------+
5 rows in set (0.00 sec)

mysql> select Avg(chem_mark) from student_info;
+----------------+
| Avg(chem_mark) |
+----------------+
|        70.6667 |
+----------------+
1 row in set (0.04 sec)


mysql> select avg(math_mark) from student_info where name like 'x%';
+----------------+
| avg(math_mark) |
+----------------+
|        57.0000 |
+----------------+
1 row in set (0.00 sec)

mysql> select name from student_info where math_mark>=70;
+------+
| name |
+------+
| MNO  |
| WXYZ |
+------+
2 rows in set (0.00 sec)



  ****************************************************   Employee and department********************************************************************************************8*
Enter password: *****
Welcome to the MySQL monitor.  Commands end with ; or \g.
Your MySQL connection id is 34
Server version: 8.0.21 MySQL Community Server - GPL

Copyright (c) 2000, 2020, Oracle and/or its affiliates. All rights reserved.

Oracle is a registered trademark of Oracle Corporation and/or its
affiliates. Other names may be trademarks of their respective
owners.

Type 'help;' or '\h' for help. Type '\c' to clear the current input statement.

mysql> use stud;
Database changed
mysql> select * from department;
+------+-------------+------------
| d_no | d_name      | d_location |
+------+-------------+------------+
|    1 | computer    | pune       |
|    2 | physics     | uruli      |
|    3 | biology     | uk         |
|    4 | maths       | loni       |
|    5 | electronics | theur      |
+------+-------------+------------+
5 rows in set (0.05 sec)


mysql> create table employee(e_no int primary key,e_Name varchar(20),e_designation varchar(20),e_salary int,d_no1 int references department(d_no));
Query OK, 0 rows affected (0.56 sec)

mysql> select * from employee;
Empty set (0.15 sec)

mysql> insert into employee values(101,'monika','clerk',10000,1);
Query OK, 1 row affected (0.08 sec)

mysql> insert into employee values(102,'pooja','manager',20000,2);
Query OK, 1 row affected (0.09 sec)

mysql> insert into employee values(103,'anuja','principal',30000,3);
Query OK, 1 row affected (0.10 sec)

mysql> insert into employee values(104,'swara','employee',250000,4);
Query OK, 1 row affected (0.11 sec)

mysql> insert into employee values(105,'shreya','clerk',240000,5);
Query OK, 1 row affected (0.12 sec)


mysql> insert into employee values(106,'nakshra','manager',450000,4);
Query OK, 1 row affected (0.09 sec)

mysql> insert into employee values(107,'komal','clerk',50000,3);
Query OK, 1 row affected (0.07 sec)

mysql> select * from employee;
+------+---------+---------------+----------+-------+
| e_no | e_Name  | e_designation | e_salary | d_no1 |
+------+---------+---------------+----------+-------+
|  101 | monika  | clerk         |    10000 |     1 |
|  102 | pooja   | manager       |    20000 |     2 |
|  103 | anuja   | principal     |    30000 |     3 |
|  104 | swara   | employee      |   250000 |     4 |
|  105 | shreya  | clerk         |   240000 |     5 |
|  106 | nakshra | manager       |   450000 |     4 |
|  107 | komal   | clerk         |    50000 |     3 |
+------+---------+---------------+----------+-------+
7 rows in set (0.00 sec)

mysql> update employee set e_salary=e_salary+(e_salary*0.15) where e_designation='manager';
Query OK, 2 rows affected (0.99 sec)
Rows matched: 2  Changed: 2  Warnings: 0

mysql> select * from employee;
+------+---------+---------------+----------+-------+
| e_no | e_Name  | e_designation | e_salary | d_no1 |
+------+---------+---------------+----------+-------+
|  101 | monika  | clerk         |    10000 |     1 |
|  102 | pooja   | manager       |    23000 |     2 |
|  103 | anuja   | principal     |    30000 |     3 |
|  104 | swara   | employee      |   250000 |     4 |
|  105 | shreya  | clerk         |   240000 |     5 |
|  106 | nakshra | manager       |   517500 |     4 |
|  107 | komal   | clerk         |    50000 |     3 |
+------+---------+---------------+----------+-------+
7 rows in set (0.02 sec)

mysql> delete from employee where d_no1=1;
Query OK, 1 row affected (0.21 sec)

mysql> select * from employee;
+------+---------+---------------+----------+-------+
| e_no | e_Name  | e_designation | e_salary | d_no1 |
+------+---------+---------------+----------+-------+
|  102 | pooja   | manager       |    23000 |     2 |
|  103 | anuja   | principal     |    30000 |     3 |
|  104 | swara   | employee      |   250000 |     4 |
|  105 | shreya  | clerk         |   240000 |     5 |
|  106 | nakshra | manager       |   517500 |     4 |
|  107 | komal   | clerk         |    50000 |     3 |
+------+---------+---------------+----------+-------+
6 rows in set (0.03 sec)employee.e_no' at line 1
mysql> delete from employee where e_designation='clerk';
Query OK, 2 rows affected (0.23 sec)

mysql> select * from employee;
+------+---------+---------------+----------+-------+
| e_no | e_Name  | e_designation | e_salary | d_no1 |
+------+---------+---------------+----------+-------+
|  102 | pooja   | manager       |    23000 |     2 |
|  103 | anuja   | principal     |    30000 |     3 |
|  104 | swara   | employee      |   250000 |     4 |
|  106 | nakshra | manager       |   517500 |     4 |
+------+---------+---------------+----------+-------+
4 rows in set (0.00 sec)


